{
  "schema_version": "1.0.0",
  "case": "MINT",
  "promotion_status": "exploratory",
  "provenance_warning": "59fa23d is absent locally but was recovered by a temporary remote fetch on 2026-08-30. The planned 4eab579-to-Ascend-v043 diff still must not be attributed entirely to Ascend.",
  "evidence_refs": [
    "../evidence/npu/candidate_checks.json",
    "../evidence/npu/model_checks.json",
    "../evidence/npu/snapshot_ops_smoke.json",
    "../evidence/npu/snapshot_import_v043.json",
    "../evidence/npu/snapshot_import_v062.json",
    "../evidence/npu/prior_run_summary.json",
    "../evidence/cuda/candidate_checks.json"
  ],
  "items": [
    {
      "id": "sinusoidal-fp64-to-fp32-on-npu",
      "comparisons": ["supplemental-official-declared-59fa23d_vs_ascend-v043-package", "official-legacy-4eab579_vs_ascend-v043", "official-main-691a5e6_vs_ascend-v062"],
      "classification": "numerical_precision",
      "scope": "operator and MINT positional embedding on NPU",
      "change": "get_safe_dtype treats npu like mps and uses float32 when the caller requests float64.",
      "provenance": "Exact diff from recovered declared revision 59fa23d to the v043 snapshot; also retained in v062.",
      "evidence_status": {"static_analysis": "complete", "npu": "passed_fixed_input_metrics_recorded", "cuda": "module_functional_numerical_captured_timing_under_concurrent_load"},
      "promotion_status": "exploratory",
      "generality_assessment": "general_candidate",
      "candidate_rule_id": "pytorch.npu.sinusoidal-fp64-fallback",
      "promotion_blockers": ["Idle-device CUDA timing is pending before performance approval", "Weight-free integration probes are missing for non-MINT adapters", "Per-shape acceptance thresholds are not approved"],
      "case_only_reason": null,
      "benefits": ["Avoids an unsupported or unsuitable FP64 path on the target NPU."],
      "drawbacks": ["Changes positional embedding rounding relative to CPU FP64."],
      "rollback": "Remove npu from get_safe_dtype and run on a backend with verified FP64 support.",
      "untested": ["Live-path model output when making model-scoped claims", "Other dimensions and period ranges"]
    },
    {
      "id": "disable-torch-compile-on-npu",
      "comparisons": ["supplemental-official-declared-59fa23d_vs_ascend-v043-package", "official-legacy-4eab579_vs_ascend-v043", "official-main-691a5e6_vs_ascend-v062"],
      "classification": "operator_implementation",
      "scope": "MINT model construction on Ascend",
      "change": "compile_model is ignored for npu devices with a warning; eager forward and sampling remain active.",
      "provenance": "Exact diff from recovered declared revision 59fa23d in MINTPytorch initialization; retained in v062.",
      "evidence_status": {"static_analysis": "complete", "npu": "eager_passed_compile_failed_missing_triton_model_ab_recorded", "cuda": "compile_and_eager_passed_timing_under_concurrent_load"},
      "promotion_status": "exploratory",
      "generality_assessment": "general_candidate",
      "candidate_rule_id": "pytorch.npu.compile-capability-fallback",
      "promotion_blockers": ["The observed NPU failure is specific to one missing-Triton environment", "A successful NPU compile control is missing", "A second torch/torch-npu environment and weight-free adapter integration are missing", "Approved version scope and thresholds are unset", "Idle-device CUDA timing is pending before performance approval"],
      "case_only_reason": null,
      "benefits": ["Keeps the deployed MINT path executable in the recorded Ascend environment."],
      "drawbacks": ["May forgo compile optimizations; no same-device performance A/B is complete."],
      "rollback": "Set compile_model=false explicitly or restore upstream compile branch after backend validation.",
      "untested": ["NPU model compile correctness", "Same-device warm performance", "Other torch-npu releases"]
    },
    {
      "id": "prefix-embedding-dtype-alignment",
      "comparisons": ["supplemental-official-declared-59fa23d_vs_ascend-v043-package", "official-legacy-4eab579_vs_ascend-v043", "official-main-691a5e6_vs_ascend-v062"],
      "classification": "numerical_precision",
      "scope": "MINT prefix forward and KV cache",
      "change": "Prefix embeddings are converted to the first language attention q_proj weight dtype before the cached prefix forward.",
      "provenance": "Exact diff from recovered declared revision 59fa23d near full inference prefix construction; retained in v062.",
      "evidence_status": {"static_analysis": "complete", "npu": "fixed_checkpoint_baseline_failed_candidate_passed", "cuda": "module_mixed_dtype_rejected_aligned_passed_timing_under_concurrent_load"},
      "promotion_status": "exploratory",
      "generality_assessment": "general_candidate",
      "candidate_rule_id": "pytorch.attention.cache-dtype-alignment",
      "promotion_blockers": ["The failing MINT baseline cannot provide paired model deltas", "Weight-free integration is missing for non-MINT adapters", "Idle-device CUDA timing is pending before performance approval", "Approved module and adapter thresholds are unset"],
      "case_only_reason": null,
      "benefits": ["Aligns prefix/query projection input dtype with model weights and downstream cache."],
      "drawbacks": ["Introduces a conversion and may hide an upstream mixed-dtype configuration error."],
      "rollback": "Remove the conversion and keep the whole prefix/model in one explicitly configured dtype.",
      "untested": ["Before/after action delta because baseline produces no output", "FP32 model configuration", "Fused and quantized cache behavior"]
    },
    {
      "id": "suffix-query-kv-mask-dtype-alignment",
      "comparisons": ["official-main-691a5e6_vs_ascend-v062"],
      "classification": "numerical_precision",
      "scope": "MINT next-scale autoregression and SDPA",
      "change": "Generated suffix embeddings and 4D attention masks use the attention projection target dtype before KV-cache forward.",
      "provenance": "Direct source inspection; mixed-dtype SDPA is isolated by candidate_checks.py.",
      "evidence_status": {"static_analysis": "complete", "npu": "mixed_dtype_failed_aligned_dtype_passed_suffix_model_ab_pending", "cuda": "generic_sdpa_module_control_captured_timing_under_concurrent_load"},
      "promotion_status": "exploratory",
      "generality_assessment": "general_candidate",
      "candidate_rule_id": "pytorch.attention.cache-dtype-alignment",
      "promotion_blockers": ["The current codemod does not cover suffix and mask adapters", "Suffix/mask integration evidence is pending", "Fused, quantized and intentionally heterogeneous attention paths are untested", "Per-adapter thresholds are unset"],
      "case_only_reason": null,
      "benefits": ["Prevents query/key/value and mask dtype divergence in the cached attention path."],
      "drawbacks": ["Additional casts; exact output delta is not yet measured at model level."],
      "rollback": "Use a single model dtype from construction and remove local casts after verifying cache tensors.",
      "untested": ["Complete-model before/after A/B", "All attention implementations", "CUDA"]
    },
    {
      "id": "vqvae-config-inlined-v043",
      "comparisons": ["official-legacy-4eab579_vs_ascend-v043"],
      "classification": "mint_specific_change",
      "scope": "MINT configuration and tokenizer release",
      "change": "VQVAE runtime parameters are embedded in MINTConfig instead of being loaded from config.yaml beside the checkpoint.",
      "provenance": "Near-neighbor diff only; unavailable 59fa23d prevents Ascend attribution.",
      "evidence_status": {"static_analysis": "complete", "npu": "deployed_configuration_passed", "cuda": "pending_cuda"},
      "promotion_status": "exploratory",
      "generality_assessment": "case_only",
      "candidate_rule_id": null,
      "promotion_blockers": ["The tokenizer release contract is not content-addressed", "Mismatch behavior across tokenizer releases is untested"],
      "case_only_reason": "This embeds MINT VQVAE release parameters and is not an NPU execution invariant.",
      "benefits": ["Allows a self-contained policy config when the known tokenizer layout matches."],
      "drawbacks": ["Can silently mismatch another tokenizer checkpoint; removes runtime config validation."],
      "rollback": "Restore config.yaml resolution and horizon/runtime parameter validation.",
      "untested": ["Other VQVAE releases", "Non-LIBERO tokenizer", "Mismatch failure modes"]
    },
    {
      "id": "vqvae-checkpoint-directory-discovery",
      "comparisons": ["official-legacy-4eab579_vs_ascend-v043"],
      "classification": "checkpoint_release_semantics",
      "scope": "MINT tokenizer checkpoint loading",
      "change": "A directory is searched recursively for .pth files and the newest mtime is selected when multiple files exist.",
      "provenance": "Near-neighbor diff only; not necessarily an Ascend change.",
      "evidence_status": {"static_analysis": "complete", "npu": "single_known_checkpoint_passed", "cuda": "pending_cuda"},
      "promotion_status": "exploratory",
      "generality_assessment": "case_only",
      "candidate_rule_id": null,
      "promotion_blockers": ["Multiple-checkpoint and corrupt-checkpoint controls are missing", "mtime selection has no stable artifact identity"],
      "case_only_reason": "This accepts one MINT checkpoint directory layout; newest-mtime selection is not a safe general migration rule.",
      "benefits": ["Accepts the recorded deployment directory layout."],
      "drawbacks": ["mtime-based selection is not content-addressed and can select a wrong checkpoint."],
      "rollback": "Pass an explicit checkpoint file or restore strict latest.pth/config.yaml resolution.",
      "untested": ["Multiple-checkpoint directories", "Corrupt checkpoint", "Remote paths"]
    },
    {
      "id": "intention-ensemble-temperature-005",